{
  "version": 2,
  "project": "写字楼首层（大堂层）",
  "zones": [
    {
      "id": "lobby",
      "form": {
        "path": {
          "rings": [
            {
              "edges": {
                "west": [[0, 0], [0, 48700]],
                "north": [[0, 48700], [49005, 48700]],
                "east": [[49005, 48700], [49005, 0]],
                "south": [[49005, 0], [0, 0]]
              },
              "segments": []
            }
          ]
        }
      },
      "typology": "核心筒居中环廊（首层大堂变体）",
      "typology_reason": "outline 49.0×48.7m（axis_grid 实测），core 居中 16.6×17.1m 与标准层同位",
      "core": {
        "path": {
          "rings": [
            {
              "edges": {
                "west": [[16900, 15600], [16900, 32700]],
                "north": [[16900, 32700], [33520, 32700]],
                "east": [[33520, 32700], [33520, 15600]],
                "south": [[33520, 15600], [16900, 15600]]
              }
            }
          ]
        }
      }
    }
  ],
  "design_rationale": "rings四边矩形 49.0×48.7m（axis_grid）+ 居中核心筒 16.6×17.1m rings（与标准层同位）"
}
