{
  "version": 2,
  "project": "大型购物中心（Shopping Mall）：不规则轮廓+中庭+分散核心筒",
  "zones": [
    {
      "id": "F1",
      "form": {
        "path": {
          "rings": [
            {
              "edges": {
                "west": [[1500, 0], [1100, 169700], [14799, 183400]],
                "north": [[14799, 183400], [25200, 184400], [195500, 185300]],
                "east": [[195500, 185300], [194300, 131650], [47900, 0]],
                "south": [[47900, 0], [1500, 0]]
              },
              "segments": [
                {
                  "type": "arc",
                  "at_vertex": 0,
                  "radius_m": 15.1,
                  "note": "西南角幕墙圆角（CCW[0]=SW；source ARC r=15.1m）"
                },
                {
                  "type": "arc",
                  "at_vertex": 1,
                  "radius_m": 15.1,
                  "note": "东南角幕墙圆角（CCW[1]=SE；source ARC r=15.1m）"
                },
                {
                  "type": "arc",
                  "at_vertex": 3,
                  "radius_m": 13.8,
                  "note": "东北角幕墙圆角（CCW[3]=NE；source ARC r=13.8m sweep≈89°）"
                },
                {
                  "type": "arc",
                  "at_vertex": 6,
                  "radius_m": 11.0,
                  "note": "西北折角幕墙圆角（CCW[6]=NW；source ARC r=11.0m）"
                }
              ],
              "holes": [
                {
                  "edges": {
                    "west": [[50709, 80172], [50709, 140172]],
                    "north": [[50709, 140172], [110709, 140172]],
                    "east": [[110709, 140172], [110709, 80172]],
                    "south": [[110709, 80172], [50709, 80172]]
                  }
                }
              ]
            }
          ]
        }
      },
      "typology": "大型购物中心（不规则七边形+中庭+双核心筒）",
      "typology_reason": "外轮廓七顶点折线 + 四角 arc 近似幕墙圆角（SW/SE r=15.1m、NE r=13.8m、NW r=11.0m，source ARC）；中庭 hole；west+east 双核心筒",
      "core": [
        {
          "id": "west",
          "path": {
            "rings": [
              {
                "edges": {
                  "west": [[20000, 30000], [20000, 95000]],
                  "north": [[20000, 95000], [40000, 95000]],
                  "east": [[40000, 95000], [40000, 30000]],
                  "south": [[40000, 30000], [20000, 30000]]
                }
              }
            ]
          },
          "rationale": "西侧扶梯集群 20×65m"
        },
        {
          "id": "east",
          "path": {
            "rings": [
              {
                "edges": {
                  "west": [[140000, 130000], [140000, 160000]],
                  "north": [[140000, 160000], [160000, 160000]],
                  "east": [[160000, 160000], [160000, 130000]],
                  "south": [[160000, 130000], [140000, 130000]]
                }
              }
            ]
          },
          "rationale": "东侧扶梯集群 20×30m"
        }
      ]
    }
  ],
  "design_rationale": "rings不规则七边折线 + 4×arc（幕墙圆角近似，source ARC r=15.1/13.8/11.0m）→ normalize 产出 plan.json ring.arcs 真弧。中庭hole + 双core。"
}
