{
  "version": 2,
  "project": "美式独栋住宅（Bishop-Overland-08）：主屋+车库+门廊+露台",
  "zones": [
    {
      "id": "main",
      "form": {
        "path": {
          "rings": [
            {
              "edges": {
                "west": [[0, 5200], [0, 14300]],
                "north": [[0, 14300], [17700, 14300]],
                "east": [[17700, 14300], [17700, 0]],
                "south": [
                  [17700, 0],
                  [10900, 0],
                  [10900, 6500],
                  [8700, 6500],
                  [8700, 5200],
                  [8000, 5200],
                  [8000, 4600],
                  [4200, 4600],
                  [4200, 5200],
                  [0, 5200]
                ]
              },
              "segments": []
            },
            {
              "edges": {
                "west": [[17700, 9000], [17700, 13400]],
                "north": [[17700, 13400], [20200, 13400]],
                "east": [[20200, 13400], [20200, 9000]],
                "south": [[20200, 9000], [17700, 9000]]
              },
              "segments": []
            }
          ]
        }
      },
      "typology": "美式独栋多体量（主屋L形+露台）",
      "typology_reason": "A-FOOTPRINT 实测 inch×25.4：ring0 主屋+车库 L形 17.7×14.3m（south边含车库凸出6.8×6.5m、门廊2.2×1.3m、南墙凹口3.8×0.6m）；ring1 东侧露台 2.5×4.4m。无核心筒。"
    }
  ],
  "design_rationale": "source.dxf A-FOOTPRINT 两独立ring：主屋L形（south大折含车库/门廊/凹口）+ 露台。无core。"
}
