{
  "version": 2,
  "project": "双中庭长板式购物中心",
  "zones": [
    {
      "id": "F",
      "form": {
        "path": {
          "rings": [
            {
              "edges": {
                "west": [[15556, 5592], [0, 50793]],
                "north": [[0, 50793], [107999, 115031], [256969, 81970]],
                "east": [[256969, 81970], [280563, 68974], [278496, 20580]],
                "south": [[278496, 20580], [263618, 5984], [232125, 200], [87025, 0], [15556, 5592]]
              },
              "segments": [],
              "holes": [
                {
                  "edges": {
                    "west": [[40000, 33000], [40000, 63000]],
                    "north": [[40000, 63000], [70000, 63000]],
                    "east": [[70000, 63000], [70000, 33000]],
                    "south": [[70000, 33000], [40000, 33000]]
                  }
                },
                {
                  "edges": {
                    "west": [[230000, 37000], [230000, 67000]],
                    "north": [[230000, 67000], [260000, 67000]],
                    "east": [[260000, 67000], [260000, 37000]],
                    "south": [[260000, 37000], [230000, 37000]]
                  }
                }
              ]
            }
          ]
        }
      },
      "typology": "双中庭长板式购物中心",
      "typology_reason": "外轮廓 280.6×115.0m 九顶点折线（四边均非直线）；双中庭 hole 30×30m；west/mid/east 三核心筒",
      "core": [
        {
          "id": "west",
          "path": {
            "rings": [
              {
                "edges": {
                  "west": [[10000, 30000], [10000, 70000]],
                  "north": [[10000, 70000], [30000, 70000]],
                  "east": [[30000, 70000], [30000, 30000]],
                  "south": [[30000, 30000], [10000, 30000]]
                }
              }
            ]
          },
          "rationale": "西侧核心筒 20×40m"
        },
        {
          "id": "mid",
          "path": {
            "rings": [
              {
                "edges": {
                  "west": [[130000, 45000], [130000, 65000]],
                  "north": [[130000, 65000], [150000, 65000]],
                  "east": [[150000, 65000], [150000, 45000]],
                  "south": [[150000, 45000], [130000, 45000]]
                }
              }
            ]
          },
          "rationale": "中部核心筒 20×20m（axis mid 退化，取 anchor 周边）"
        },
        {
          "id": "east",
          "path": {
            "rings": [
              {
                "edges": {
                  "west": [[240000, 30000], [240000, 70000]],
                  "north": [[240000, 70000], [260000, 70000]],
                  "east": [[260000, 70000], [260000, 30000]],
                  "south": [[260000, 30000], [240000, 30000]]
                }
              }
            ]
          },
          "rationale": "东侧核心筒 20×40m"
        }
      ]
    }
  ],
  "design_rationale": "rings九顶点不规则折线+双中庭holes+三core。长边斜折表达轮廓曲线采样。"
}
