{
  "version": 2,
  "project": "写字楼标准层（普通办公层）",
  "zones": [
    {
      "id": "std",
      "form": {
        "path": {
          "rings": [
            {
              "edges": {
                "west": [[0, 0], [0, 45995]],
                "north": [[0, 45995], [47465, 45995]],
                "east": [[47465, 45995], [47465, 0]],
                "south": [[47465, 0], [0, 0]]
              },
              "segments": []
            }
          ]
        }
      },
      "typology": "核心筒居中环廊",
      "typology_reason": "outline 47.5×46.0m（axis_grid 实测），core 居中 16.6×17.1m",
      "core": {
        "path": {
          "rings": [
            {
              "edges": {
                "west": [[15400, 14400], [15400, 31500]],
                "north": [[15400, 31500], [31997, 31500]],
                "east": [[31997, 31500], [31997, 14400]],
                "south": [[31997, 14400], [15400, 14400]]
              }
            }
          ]
        }
      }
    }
  ],
  "design_rationale": "rings四边矩形 47.5×46.0m（axis_grid）+ 居中核心筒 16.6×17.1m rings"
}
