{
 "version": 2,
 "project": "高层住宅标准层：三核心筒六户板式",
 "zones": [
  {
   "id": "std",
   "form": {
    "path": {
     "rings": [
      {
       "edges": {
        "west": [
         [
          0,
          800
         ],
         [
          0,
          12750
         ]
        ],
        "north": [
         [
          0,
          12750
         ],
         [
          6140,
          12750
         ],
         [
          6140,
          15550
         ],
         [
          11440,
          15550
         ],
         [
          11440,
          12750
         ],
         [
          20640,
          12750
         ],
         [
          20640,
          15750
         ],
         [
          34440,
          15750
         ],
         [
          34440,
          12750
         ],
         [
          44040,
          12750
         ],
         [
          44040,
          15550
         ],
         [
          49340,
          15550
         ],
         [
          49340,
          12750
         ],
         [
          55540,
          12750
         ]
        ],
        "east": [
         [
          55540,
          12750
         ],
         [
          55540,
          800
         ]
        ],
        "south": [
         [
          55540,
          800
         ],
         [
          53100,
          800
         ],
         [
          53100,
          -150
         ],
         [
          2400,
          -150
         ],
         [
          2400,
          800
         ],
         [
          0,
          800
         ]
        ]
       },
       "segments": []
      }
     ]
    }
   },
   "typology": "三核心筒六户板式（轮廓直写真实形态）",
   "typology_reason": "轮廓=20顶点真实形态直写四边（非矩形主体）：south 6点含连续阳台带下凸0.95m（x2400~53100）与西南台阶；north 14点含3核心筒凸出（x6140~11440/20640~34440/44040~49340，深2.8~3.0m）；核心筒投影是真实轮廓的一部分，不是矩形主体补丁",
   "core": [
    {
     "id": "west",
     "path": {
      "rings": [
       {
        "edges": {
         "west": [
          [
           6230,
           8464
          ],
          [
           6230,
           12342
          ]
         ],
         "north": [
          [
           6230,
           12342
          ],
          [
           12170,
           12342
          ]
         ],
         "east": [
          [
           12170,
           12342
          ],
          [
           12170,
           8464
          ]
         ],
         "south": [
          [
           12170,
           8464
          ],
          [
           10951,
           8464
          ],
          [
           10951,
           5240
          ],
          [
           8001,
           5240
          ],
          [
           8001,
           8464
          ],
          [
           6230,
           8464
          ]
         ]
        }
       }
      ]
     },
     "rationale": "west核心筒 凸字形(上半5.9×3.9m 下半3.0×3.2m)"
    },
    {
     "id": "mid",
     "path": {
      "rings": [
       {
        "edges": {
         "west": [
          [
           24733,
           8958
          ],
          [
           24733,
           12665
          ]
         ],
         "north": [
          [
           24733,
           12665
          ],
          [
           29958,
           12665
          ]
         ],
         "east": [
          [
           29958,
           12665
          ],
          [
           29958,
           8958
          ]
         ],
         "south": [
          [
           29958,
           8958
          ],
          [
           28676,
           8958
          ],
          [
           28676,
           6865
          ],
          [
           24954,
           6865
          ],
          [
           24954,
           8958
          ],
          [
           24733,
           8958
          ]
         ]
        }
       }
      ]
     },
     "rationale": "mid核心筒 凸字形(上半5.2×3.7m 下半3.7×2.1m)"
    },
    {
     "id": "east",
     "path": {
      "rings": [
       {
        "edges": {
         "west": [
          [
           42631,
           8350
          ],
          [
           42631,
           12889
          ]
         ],
         "north": [
          [
           42631,
           12889
          ],
          [
           47909,
           12889
          ]
         ],
         "east": [
          [
           47909,
           12889
          ],
          [
           47909,
           8350
          ]
         ],
         "south": [
          [
           47909,
           8350
          ],
          [
           46772,
           8350
          ],
          [
           46772,
           5217
          ],
          [
           43545,
           5217
          ],
          [
           43545,
           8350
          ],
          [
           42631,
           8350
          ]
         ]
        }
       }
      ]
     },
     "rationale": "east核心筒 凸字形(上半5.3×4.5m 下半3.2×3.1m)"
    }
   ]
  }
 ],
 "design_rationale": "rings[0]主体矩形(55.5×12.0m) + 4 segments(3核心筒projection N + 1阳台projection S)；3个core凸字形rings格式"
}