{
  "version": 2,
  "project": "并排多单元板式（一梯两户×2单元）",
  "zones": [
    {
      "id": "std",
      "form": {
        "path": {
          "rings": [
            {
              "edges": {
                "west": [
                  [
                    0,
                    724
                  ],
                  [
                    1092,
                    12711
                  ]
                ],
                "north": [
                  [
                    1092,
                    12711
                  ],
                  [
                    13773,
                    11868
                  ],
                  [
                    17371,
                    13174
                  ],
                  [
                    20641,
                    12700
                  ],
                  [
                    22880,
                    15680
                  ],
                  [
                    24931,
                    16178
                  ],
                  [
                    29875,
                    14868
                  ],
                  [
                    42943,
                    15681
                  ],
                  [
                    44043,
                    14665
                  ]
                ],
                "east": [
                  [
                    44043,
                    14665
                  ],
                  [
                    42860,
                    3523
                  ]
                ],
                "south": [
                  [
                    42860,
                    3523
                  ],
                  [
                    27146,
                    3817
                  ],
                  [
                    19284,
                    0
                  ],
                  [
                    13989,
                    990
                  ],
                  [
                    19239,
                    2299
                  ],
                  [
                    19010,
                    5681
                  ],
                  [
                    17100,
                    8225
                  ],
                  [
                    13883,
                    8586
                  ],
                  [
                    10997,
                    4751
                  ],
                  [
                    12169,
                    1074
                  ],
                  [
                    9146,
                    963
                  ],
                  [
                    10729,
                    2609
                  ],
                  [
                    10545,
                    5671
                  ],
                  [
                    7494,
                    8680
                  ],
                  [
                    4519,
                    8111
                  ],
                  [
                    2351,
                    2654
                  ],
                  [
                    4062,
                    1051
                  ],
                  [
                    6759,
                    876
                  ],
                  [
                    0,
                    724
                  ]
                ]
              },
              "segments": []
            }
          ]
        }
      },
      "typology": "并排多单元双核心筒四户板式",
      "typology_reason": "west边2v斜墙(12,724→1092,12711)；north边9v含核心筒凸出(x22.9~24.9m y到16.2m)+主体折线；east边2v大切角(44043→42860 y从14.7到3.5m)；south边19v含天井/阳台/入口大量凹凸折；总bbox 44.0×16.2m",
      "core": [
        {
          "id": "west",
          "path": {
            "rings": [
              {
                "edges": {
                  "west": [
                    [
                      9600,
                      9200
                    ],
                    [
                      9600,
                      12700
                    ]
                  ],
                  "north": [
                    [
                      9600,
                      12700
                    ],
                    [
                      12200,
                      12700
                    ]
                  ],
                  "east": [
                    [
                      12200,
                      12700
                    ],
                    [
                      12200,
                      9200
                    ]
                  ],
                  "south": [
                    [
                      12200,
                      9200
                    ],
                    [
                      9600,
                      9200
                    ]
                  ]
                }
              }
            ]
          },
          "rationale": "west核心筒 矩形 2.6×3.5m"
        },
        {
          "id": "east",
          "path": {
            "rings": [
              {
                "edges": {
                  "west": [
                    [
                      31500,
                      12700
                    ],
                    [
                      31500,
                      15200
                    ]
                  ],
                  "north": [
                    [
                      31500,
                      15200
                    ],
                    [
                      34100,
                      15200
                    ]
                  ],
                  "east": [
                    [
                      34100,
                      15200
                    ],
                    [
                      34100,
                      12700
                    ]
                  ],
                  "south": [
                    [
                      34100,
                      12700
                    ],
                    [
                      31500,
                      12700
                    ]
                  ]
                }
              }
            ]
          },
          "rationale": "east核心筒 矩形 2.6×2.5m"
        }
      ]
    }
  ],
  "design_rationale": "rings[0]四边分段：west(2v斜墙)+north(9v含核心筒凸出)+east(2v大切角)+south(19v含天井/阳台凹凸折)。轮廓从source.dxf WALL LINE提取(buffer400→close2000→simp800)；2个core矩形rings格式"
}