{
  "version": 2,
  "project": "裙房商业满铺+塔楼住宅上叠",
  "zones": [
    {
      "id": "podium",
      "form": {
        "path": {
          "rings": [
            {
              "edges": {
                "west": [[0, 0], [0, 40000]],
                "north": [[0, 40000], [60000, 40000]],
                "east": [[60000, 40000], [60000, 0]],
                "south": [[60000, 0], [0, 0]]
              }
            }
          ]
        }
      },
      "typology": "沿街商业裙房",
      "typology_reason": "exposure_m.S=60m → 裙房满铺占地 60×40m"
    },
    {
      "id": "tower",
      "form": {
        "path": {
          "rings": [
            {
              "edges": {
                "west": [[18000, 22000], [18000, 40000]],
                "north": [[18000, 40000], [42000, 40000]],
                "east": [[42000, 40000], [42000, 22000]],
                "south": [[42000, 22000], [18000, 22000]]
              }
            }
          ]
        }
      },
      "core": {
        "path": {
          "rings": [
            {
              "edges": {
                "west": [[25000, 26000], [25000, 32000]],
                "north": [[25000, 32000], [35000, 32000]],
                "east": [[35000, 32000], [35000, 26000]],
                "south": [[35000, 26000], [25000, 26000]]
              }
            }
          ]
        }
      },
      "typology": "塔楼住宅",
      "typology_reason": "塔楼 24×18m 收进裙房北部上叠"
    }
  ],
  "spatial_relations": [
    {"from": "tower", "rel": "on", "to": "podium", "align": "north_center"}
  ],
  "design_rationale": "podium_tower：裙房满铺 60×40m + 塔楼收进 24×18m；core_stack 居中 10×6m"
}
