{
  "version": 2,
  "project": "影院层变体",
  "zones": [
    {
      "id": "F",
      "form": {
        "path": {
          "rings": [
            {
              "edges": {
                "west": [[24938, 5650], [0, 43870], [2078, 53248]],
                "north": [[2078, 53248], [61961, 88522], [113163, 107699], [225224, 77457]],
                "east": [[225224, 77457], [260326, 39533], [245665, 7200]],
                "south": [[245665, 7200], [218588, 200], [49888, 0], [24938, 5650]]
              },
              "segments": [],
              "holes": []
            }
          ]
        }
      },
      "typology": "影院层变体",
      "typology_reason": "外轮廓 260.3×107.7m 十顶点折线（四边均非直线，无中庭）；west+east 双核心筒同位",
      "core": [
        {
          "id": "west",
          "path": {
            "rings": [
              {
                "edges": {
                  "west": [[10000, 30000], [10000, 70000]],
                  "north": [[10000, 70000], [30000, 70000]],
                  "east": [[30000, 70000], [30000, 30000]],
                  "south": [[30000, 30000], [10000, 30000]]
                }
              }
            ]
          },
          "rationale": "西侧核心筒 20×40m（与普通层同位）"
        },
        {
          "id": "east",
          "path": {
            "rings": [
              {
                "edges": {
                  "west": [[230000, 30000], [230000, 70000]],
                  "north": [[230000, 70000], [250000, 70000]],
                  "east": [[250000, 70000], [250000, 30000]],
                  "south": [[250000, 30000], [230000, 30000]]
                }
              }
            ]
          },
          "rationale": "东侧核心筒 20×40m"
        }
      ]
    }
  ],
  "design_rationale": "rings十顶点不规则折线（影院层外扩/切角）+ 双core同位。无中庭hole。"
}
